DECLARE PANPAN,EMER,SOP,Navigation,Altitude,SET ACCORDINGLY,yellow,yellow,orange,orange,,,,,,0,is_acked,Will set altitude to three thousand on your approval,TARS will set altitude as indicated by ATC upon pilot approval,TARS will display altitude as indicated by ATC,,,
AFTER TAKEOFF,NORM,SOP,Checklist Mgmt,Checklist,ORDER START,yellow,yellow,green,,TARS displays checklist progress and status updates to pilot.,Pilot anticipates TARS's checklist sequence and timing.,Pilot can postpone checklist execution.,"Aircraft configuration, engine status, flight path, checklist items.",prompt_start_checklist,5,is_acked,Starting After Takeoff Normal Checklist,TARS will announce starting checklist then proceed to start,TARS will display next checklist and wait,,,
AFTER TAKEOFF,NORM,Checklist,Switch / Lever,LANDING GEAR Handle,UP,green,green,red,,TARS must display gear status.,,,"Gear status, airspeed, altitude.",,0,is_acked,,,TARS will check L/G status and announce result,continuous,is_gear_retracted,end_of_procedure
AFTER TAKEOFF,NORM,Checklist,Parameter Check,Airspeed,CHECK V2 + 10,yellow,yellow,green,,Human sees TARS' airspeed checks and status updates.,,,"Current airspeed, V2 speed, aircraft configuration.",,0,is_acked,,TARS will check airspeed status callout if too slow,TARS will display airspeed target value,,,
AFTER TAKEOFF,NORM,Checklist,Environment Check,Obstacles,CHECK CLEAR,yellow,red,red,,,,,"Obstacle proximity, aircraft altitude, climb rate.",,5,is_acked,,,,,,
AFTER TAKEOFF,NORM,Checklist,Switch / Lever,FLAP Handle,UP,green,green,red,,TARS must display flap status.,Human must anticipate TARS's verbal reminders for flap retraction.,,"Flap position, airspeed, altitude, and climb rate.",,0,is_acked,Retract flaps,,TARS will check flaps status and announce result,,,
AFTER TAKEOFF,NORM,Checklist,Switch / Lever,THROTTLES,CLB Detent,green,green,red,,TARS must display throttle detent status to pilot.,,,"Throttle position, climb rate, engine performance data.",,0,is_acked,Set Throttles to Climb detent,,TARS will sense action and go to the next item,,,
AFTER TAKEOFF,NORM,Checklist,Switch / Lever,Yaw Damper,AS DESIRED,yellow,green,orange,orange,TARS displays yaw damper status changes to pilot.,TARS anticipates pilot's yaw damper adjustments.,Pilot commands TARS to adjust yaw damper settings.,"Yaw damper status, aircraft attitude, flight phase.",yaw_damper_as_desired,5,is_acked,,TARS will engage yaw damper if no engine failure upon pilot approval,TARS will give yaw damper usage suggestion,,,
AFTER TAKEOFF,NORM,Checklist,Switch / Lever,Anti-Ice/Deice Systems,AS REQUIRED,yellow,green,red,,TARS displays anti-ice system status; pilot confirms visual indicators.,TARS alerts pilot of potential anti-ice activation needs.,,"Outside air temperature, wing surface status, system activation status.",anti_ice_systems_as_required,0,is_acked,,,TARS will suggest action,,,
AFTER TAKEOFF,NORM,Checklist,Switch / Lever,PAX SAFETY Switch,AS REQUIRED,yellow,green,red,,TARS must display PAX SAFETY switch status to pilot and requirement.,,,"PAX SAFETY switch position, checklist status.",pax_safety_switch_as_required,0,is_acked,,,TARS will suggest action,,,
AFTER TAKEOFF,NORM,Checklist,Switch / Lever,LANDING Light Switch,AS REQUIRED,yellow,green,red,,TARS must display landing light status to the pilot and requirement.,Pilot must anticipate TARS's reminders for landing light status.,,"Landing light switch position, current flight phase.",landing_light_as_required_after_takeoff,0,is_acked,,,TARS will suggest action,,,
AFTER TAKEOFF,NORM,Checklist,System Check,Pressurization,CHECK,green,green,green,,TARS displays pressurization status to pilot.,TARS anticipates pilot's pressurization check initiation.,,"Cabin altitude, differential pressure, system status.",pressurization_check,2,5,Checking pressurization,TARS will check cabin pressurization and announce result,TARS will remind normal pressure range,,,
AFTER TAKEOFF,NORM,Checklist,Switch / Lever,Altimeters (transition altitude),SET STD,green,green,green,,TARS displays altimeter setting changes; pilot confirms via cockpit display.,"TARS anticipates pilot's altimeter setting, pilot anticipates TARS altimeter setting",Pilot commands TARS to set altimeter to standard pressure.,"Current altitude, transition altitude, standard pressure setting.",,0,5,Will set altimeter to Standard Pressure when reaching transition altitude = {TRANSITION_ALTITUDE} feet,TARS will announce then set altimeters to STD upon reaching transition altitude,TARS will display transition altitude value,,,
AFTER TAKEOFF,NORM,Checklist,System Check,Altimeters (transition altitude),CROSSCHECK,green,,red,,"Human must confirm crosscheck.",,,"Current altimeter setting, transition altitude.",,0,is_acked,,,,,,
AFTER TAKEOFF,NORM,Checklist,Checklist Mgmt,Checklist,ANNOUNCE COMPLETED,green,,green,,TARS displays checklist status; pilot confirms task completion visually/audibly.,TARS anticipates pilot's checklist completion cues; pilot expects TARS to announce.,,"Checklist items, task status, aircraft configuration.",,0,is_acked,After TAKEOFF checklist completed,TARS will announce current checklist completed,,,,
AFTER TAKEOFF,NORM,Checklist,Checklist Mgmt,Next Checklist,ENGINE FAILURE/PRECAUTIONARY SHUTDOWN,green,green,green,,TARS displays checklist progress.,TARS announces next checklist step before execution.,Pilot can override TARS actions via voice command.,"Engine status, autopilot mode, ATC communication status.",prompt_next_checklist,0,is_acked,Next Checklist : ENGINE FAILURE / PRECAUTIONARY SHUTDOWN CHECKLIST,TARS will announce next checklist then proceed to start,TARS will display next checklist and wait,,,
ENGINE FAILURE/PRECAUTIONARY SHUTDOWN,ABNORM,SOP,Checklist Mgmt,Checklist,ORDER START,yellow,yellow,green,,TARS displays checklist progress.,TARS announces next checklist step before execution.,Pilot can override TARS actions via voice command.,"Engine status, fuel levels, system alerts.",prompt_start_checklist,5,5,Starting ENGINE FAILURE / PRECAUTIONARY SHUTDOWN CHECKLIST,TARS will announce starting checklist then proceed to start,TARS will display next checklist and wait,,,
ENGINE FAILURE/PRECAUTIONARY SHUTDOWN,ABNORM,Checklist,Switch / Lever,Throttle (affected engine),CUTOFF,yellow,yellow,green,,TARS displays engine status and monitor pilot's actions.,,,"Engine RPM, fuel flow, oil pressure, and temperature.",,0,is_sensed,,TARS will check if affected engine throttle is cutoff ,TARS will display failed engine side,continuous,is_throttle_cutoff,end_of_procedure
ENGINE FAILURE/PRECAUTIONARY SHUTDOWN,ABNORM,Checklist,Other,CAUTION text,READ,green,green,green,,,,Pilot can override TARS actions; TARS prompts pilot for confirmation.,"Engine status, checklist steps, ATC communication status, autopilot engagement.",,0,45,"""If possible, the engines should remain at idle for a minimum of two minutes prior to shutdown to allow the engine inter-turbine temperatures to stabilize and avoid turbine blade rub.
If the engine windmills for more than fifteen minutes without a positive indication of oil pressure, a notation is required in the engine logbook and the engine must be inspected in accordance with the
pratt and whitney engine maintenance manual.
If the engine windmills for more than fifteen minutes with the firewall shutoff closed or the boost pump turned off, the engine fuel pump must be inspected in accordance with the Pratt and Whitney Engine
Maintenance Manual.""",TARS will read the caution text,TARS will display the caution text,,,
ENGINE FAILURE/PRECAUTIONARY SHUTDOWN,ABNORM,Checklist,Switch / Lever,GEN Switch (affected side),OFF,green,green,red,,TARS displays GEN switch status and monitor pilot's actions.,,,"GEN switch status, engine parameters, checklist steps.",,0,is_acked,GEN Switch {engine_failed_side} OFF,,TARS will announce affected engine side,transition,is_gen_switch_off,next_task
ENGINE FAILURE/PRECAUTIONARY SHUTDOWN,ABNORM,Checklist,Switch / Lever,IGNITION switch (affected side),NORM,green,green,red,,TARS displays IGN switch status and monitor pilot's actions.,,,"Ignition switch status, engine performance data.",,0,is_acked,GEN Switch {engine_failed_side} NORM,,TARS will announce affected engine side,transition,is_ignition_switch_norm,next_task
ENGINE FAILURE/PRECAUTIONARY SHUTDOWN,ABNORM,Checklist,Switch / Lever,Electrical Load,REDUCE as required (<= 300A),yellow,yellow,yellow,yellow,TARS must display current electrical load and recommendations.,Human must anticipate TARS's suggestions for load reduction.,Human can command TARS to suggest specific load reduction actions.,"Current electrical load, available systems to shed, load reduction targets.",,0,is_acked,Checking electrical load,,TARS will display current electrical load and safe limit,,,
ENGINE FAILURE/PRECAUTIONARY SHUTDOWN,ABNORM,Checklist,Switch / Lever,Fuel TRANSFER Knob,AS REQUIRED,yellow,yellow,green,,TARS must display fuel transfer status to pilot.,,,"Fuel levels, transfer knob position, engine status.",,0,is_acked,,TARS will check the fuel quantity and set fuel transfer to balance if necessary,TARS will suggest action,,,
ENGINE FAILURE/PRECAUTIONARY SHUTDOWN,ABNORM,Checklist,System Check,Verify ENGINE FIRE Switch (affected side),Is pushed,green,green,red,,Human sees TARS status on ENGINE FIRE switch engagement.,Human anticipates TARS will verify switch engagement.,Human can override TARS actions via verbal command.,"ENGINE FIRE switch status, engine parameters.",,0,is_acked,,,TARS will announce affected engine side,,,
ENGINE FAILURE/PRECAUTIONARY SHUTDOWN,ABNORM,Checklist,Checklist Mgmt,Next checklist,SINGLE-ENGINE APPROACH AND LANDING,green,green,green,,TARS displays checklist progress.,TARS anticipates pilot's checklist initiation.,Pilot can command TARS to adjust checklist priorities; TARS suggests checklist priorities.,"Engine status, checklist steps, autopilot settings, ATC communications.",prompt_next_checklist,0,is_acked,"Checklist finished, Next checklist Single-Engine approach and landing",TARS will announce next checklist then proceed to start,TARS will display next checklist and wait,,,
